{
  "schema_version": "v1",
  "project": "contiki-ng",
  "cve": "CVE-2021-21281",
  "evidence_irs": [
    {
      "id": "IR-001",
      "entrypoint": {
        "function": "tcpip_input",
        "file": "os/net/ipv6/tcpip.c",
        "line": 445
      },
      "runtime_context": {
        "trigger_type": "event",
        "trigger_ref": "Inbound IPv6 TCP segment delivered from sicslowpan/radio layer",
        "config_flags": ["UIP_TCP=1", "UIP_CONF_IPV6=1"]
      },
      "path": {
        "nodes": [
          {"function": "tcpip_input", "file": "os/net/ipv6/tcpip.c", "line": 445, "role": "entry"},
          {"function": "packet_input", "file": "os/net/ipv6/tcpip.c", "line": 164, "role": "intermediate"},
          {"function": "uip_process", "file": "os/net/ipv6/uip6.c", "line": 948, "role": "intermediate"},
          {"function": "uip_process", "file": "os/net/ipv6/uip6.c", "line": 1120, "role": "guard"},
          {"function": "uip_process", "file": "os/net/ipv6/uip6.c", "line": 1613, "role": "guard"},
          {"function": "uip_process", "file": "os/net/ipv6/uip6.c", "line": 1842, "role": "intermediate"},
          {"function": "uip_process", "file": "os/net/ipv6/uip6.c", "line": 1846, "role": "sink"}
        ],
        "edges": [
          {"from": "tcpip_input", "to": "packet_input", "kind": "controlflow"},
          {"from": "packet_input", "to": "uip_process", "kind": "call"},
          {"from": "uip_process@1842", "to": "uip_process@1846", "kind": "dataflow"}
        ]
      },
      "conditions": {
        "required": [
          "Incoming IPv6 packet's next-header / protocol resolves to UIP_PROTO_TCP",
          "TCP checksum is valid (uip_tcpchksum() == 0xffff at uip6.c:1613)",
          "Source and destination ports are non-zero (uip6.c:1623)",
          "Some active TCP connection matches (or listening connection accepts SYN), so control reaches the 'found:' label and proceeds to uip6.c:1842",
          "Attacker chooses tcpoffset's high nibble such that (high_nibble << 2) + UIP_IPH_LEN > uip_len, e.g., tcpoffset=0xF0 -> c=60, while uip_len is small enough that uip_len - 60 - 40 underflows uint16_t"
        ],
        "blocking": [
          "Existence of the 'uip_len < c + UIP_IPH_LEN' guard (added in fix_commit) would drop the packet before line 1846. Absent in vulnerable_commit."
        ]
      },
      "evidence_anchors": [
        {"file": "os/net/ipv6/uip6.c", "line_start": 1842, "line_end": 1842, "note": "c = (UIP_TCP_BUF->tcpoffset >> 4) << 2;"},
        {"file": "os/net/ipv6/uip6.c", "line_start": 1846, "line_end": 1846, "note": "uip_len = uip_len - c - UIP_IPH_LEN; -- underflow site"},
        {"file": "os/net/ipv6/uip6.c", "line_start": 159, "line_end": 159, "note": "uip_len declared uint16_t -> determines wraparound modulus"},
        {"file": "os/net/ipv6/uip.h", "line_start": 56, "line_end": 64, "note": "UIP_IPH_LEN=40, UIP_TCPH_LEN=20 macros consumed at the sink"}
      ],
      "confidence": "high",
      "uncertainty": "Exact downstream OOB-read offset depends on which subsequent code path consumes uip_len. The advisory characterizes it as out-of-bounds read; specific deref offsets vary by connection state machine branch."
    },
    {
      "id": "IR-002",
      "entrypoint": {
        "function": "input_callback",
        "file": "os/net/ipv6/sicslowpan.c",
        "line": 2056
      },
      "runtime_context": {
        "trigger_type": "event",
        "trigger_ref": "6LoWPAN reassembly completes for an inbound IPv6 datagram carrying TCP",
        "config_flags": ["UIP_TCP=1", "SICSLOWPAN enabled", "UIP_CONF_IPV6=1"]
      },
      "path": {
        "nodes": [
          {"function": "input_callback", "file": "os/net/ipv6/sicslowpan.c", "line": 2056, "role": "entry"},
          {"function": "tcpip_input", "file": "os/net/ipv6/tcpip.c", "line": 445, "role": "intermediate"},
          {"function": "packet_input", "file": "os/net/ipv6/tcpip.c", "line": 164, "role": "intermediate"},
          {"function": "uip_process", "file": "os/net/ipv6/uip6.c", "line": 948, "role": "intermediate"},
          {"function": "uip_process", "file": "os/net/ipv6/uip6.c", "line": 1842, "role": "intermediate"},
          {"function": "uip_process", "file": "os/net/ipv6/uip6.c", "line": 1846, "role": "sink"}
        ],
        "edges": [
          {"from": "input_callback", "to": "tcpip_input", "kind": "call"},
          {"from": "tcpip_input", "to": "packet_input", "kind": "controlflow"},
          {"from": "packet_input", "to": "uip_process", "kind": "call"},
          {"from": "uip_process@1842", "to": "uip_process@1846", "kind": "dataflow"}
        ]
      },
      "conditions": {
        "required": [
          "6LoWPAN reassembly succeeds (attacker provides valid 6LoWPAN frame fragmentation)",
          "Reassembled datagram's protocol = UIP_PROTO_TCP",
          "All conditions from IR-001 (checksum, ports, connection match, attacker-chosen tcpoffset)"
        ],
        "blocking": [
          "Same as IR-001: missing uip_len < c + UIP_IPH_LEN guard at uip6.c:1842-1846."
        ]
      },
      "evidence_anchors": [
        {"file": "os/net/ipv6/sicslowpan.c", "line_start": 2056, "line_end": 2056, "note": "tcpip_input() invocation after reassembly"},
        {"file": "os/net/ipv6/uip6.c", "line_start": 1842, "line_end": 1846, "note": "Same vulnerable arithmetic as IR-001"}
      ],
      "confidence": "high",
      "uncertainty": "On platforms without 6LoWPAN (e.g. native target with tap), this IR's entrypoint is replaced by the platform-specific input adapter; the inner path through uip_process is identical. IR-001 covers that variant via tcpip_input."
    }
  ]
}
