{
  "schema_version": "v1",
  "project": "u-boot",
  "cve": "CVE-2018-3968",
  "evidence_irs": [
    {
      "id": "IR-001",
      "entrypoint": {
        "function": "do_bootm",
        "file": "common/cmd_bootm.c",
        "line": 786
      },
      "runtime_context": {
        "trigger_type": "command",
        "trigger_ref": "U_BOOT_CMD(bootm, ...) at common/cmd_bootm.c:1071-1074. The bootm command is dispatched from the U-Boot shell, a boot script (boot.scr), or the bootcmd environment variable on power-on. The board is configured with CONFIG_FIT and CONFIG_FIT_SIGNATURE so the operator believes only RSA-signed FIT images can boot.",
        "config_flags": ["CONFIG_FIT", "CONFIG_FIT_SIGNATURE", "CONFIG_BOOTM (default on Linux-launching boards)"]
      },
      "path": {
        "nodes": [
          {"function": "do_bootm",          "file": "common/cmd_bootm.c", "line": 786, "role": "entry"},
          {"function": "do_bootm",          "file": "common/cmd_bootm.c", "line": 825, "role": "intermediate"},
          {"function": "do_bootm_states",   "file": "common/cmd_bootm.c", "line": 628, "role": "intermediate"},
          {"function": "do_bootm_states",   "file": "common/cmd_bootm.c", "line": 646, "role": "intermediate"},
          {"function": "bootm_find_os",     "file": "common/cmd_bootm.c", "line": 217, "role": "intermediate"},
          {"function": "bootm_find_os",     "file": "common/cmd_bootm.c", "line": 224, "role": "intermediate"},
          {"function": "boot_get_kernel",   "file": "common/cmd_bootm.c", "line": 913, "role": "intermediate"},
          {"function": "boot_get_kernel",   "file": "common/cmd_bootm.c", "line": 954, "role": "intermediate"},
          {"function": "genimg_get_format", "file": "common/image.c",     "line": 655, "role": "intermediate"},
          {"function": "genimg_get_format", "file": "common/image.c",     "line": 661, "role": "guard"},
          {"function": "genimg_get_format", "file": "common/image.c",     "line": 662, "role": "sink"},
          {"function": "boot_get_kernel",   "file": "common/cmd_bootm.c", "line": 955, "role": "intermediate"},
          {"function": "boot_get_kernel",   "file": "common/cmd_bootm.c", "line": 958, "role": "intermediate"},
          {"function": "image_get_kernel",  "file": "common/cmd_bootm.c", "line": 862, "role": "intermediate"}
        ],
        "edges": [
          {"from": "do_bootm@825",          "to": "do_bootm_states@628",   "kind": "call"},
          {"from": "do_bootm_states@646",   "to": "bootm_find_os@217",     "kind": "call"},
          {"from": "bootm_find_os@224",     "to": "boot_get_kernel@913",   "kind": "call"},
          {"from": "boot_get_kernel@954",   "to": "genimg_get_format@655", "kind": "call"},
          {"from": "genimg_get_format@661", "to": "genimg_get_format@662", "kind": "controlflow"},
          {"from": "genimg_get_format@662", "to": "boot_get_kernel@955",   "kind": "dataflow"},
          {"from": "boot_get_kernel@955",   "to": "boot_get_kernel@958",   "kind": "controlflow"},
          {"from": "boot_get_kernel@958",   "to": "image_get_kernel@862",  "kind": "call"}
        ]
      },
      "conditions": {
        "required": [
          "Build has CONFIG_FIT_SIGNATURE set — the operator-visible promise is 'only signed FIT kernels boot'.",
          "Build does NOT compile out the legacy format path. Equivalent to: CONFIG_IMAGE_FORMAT_LEGACY is implicitly defined (always true in vulnerable_commit because the symbol does not exist yet — only added by the fix commit 21d29f7f).",
          "Attacker can place a crafted image at the bootm load address. Possible paths: writable NAND/SPI/eMMC, removable USB/SD, network-loaded buffers (tftpboot/dhcp), or a writable boot script that invokes bootm with a controlled address.",
          "The crafted image's first 4 bytes equal IH_MAGIC = 0x27051956 (include/image.h:239). The legacy uImage layout's hcrc and dcrc fields can be filled with attacker-computed CRC32 values — these are integrity checks, not authentication.",
          "The image embeds an unsigned kernel payload."
        ],
        "blocking": [
          "Post-fix (commit 21d29f7f), include/config_fallbacks.h:84-88 defines CONFIG_IMAGE_FORMAT_LEGACY only when CONFIG_FIT_SIGNATURE is NOT set. With CONFIG_FIT_SIGNATURE set, every IMAGE_FORMAT_LEGACY case in cmd_bootm.c and image.c is wrapped in #if defined(CONFIG_IMAGE_FORMAT_LEGACY) and is compiled out. genimg_get_format then returns IMAGE_FORMAT_INVALID for legacy-magic images, and boot_get_kernel's switch falls through with no LEGACY case to take.",
          "If the board's bootm load region is in non-writable memory (mask ROM, OTP) and the boot script is also not writable, the attacker has no way to land bytes at the load address. (Out of scope for the libssh-style bug pattern: a deployment-side mitigation, not a U-Boot fix.)"
        ]
      },
      "evidence_anchors": [
        {"file": "common/cmd_bootm.c", "line_start": 786,  "line_end": 786,  "note": "do_bootm declaration — bootm command handler (entry trust boundary)"},
        {"file": "common/cmd_bootm.c", "line_start": 1071, "line_end": 1074, "note": "U_BOOT_CMD(bootm, ...) registration that binds the 'bootm' shell command to do_bootm"},
        {"file": "common/cmd_bootm.c", "line_start": 825,  "line_end": 825,  "note": "do_bootm calls do_bootm_states with default BOOTM_STATE_* mask including FINDOS"},
        {"file": "common/cmd_bootm.c", "line_start": 646,  "line_end": 646,  "note": "do_bootm_states calls bootm_find_os when BOOTM_STATE_FINDOS bit is set"},
        {"file": "common/cmd_bootm.c", "line_start": 224,  "line_end": 224,  "note": "bootm_find_os calls boot_get_kernel"},
        {"file": "common/cmd_bootm.c", "line_start": 954,  "line_end": 954,  "note": "boot_get_kernel: switch (genimg_get_format(buf)) — the format dispatch"},
        {"file": "common/image.c",     "line_start": 661,  "line_end": 662,  "note": "Guard / SINK: image_check_magic(hdr) at line 661 succeeds for any blob with IH_MAGIC at offset 0; the assignment format = IMAGE_FORMAT_LEGACY at line 662 is the structural moment of bypass — the function commits to returning LEGACY without any authenticity check upstream and without any signature precondition."},
        {"file": "common/image.c",     "line_start": 672,  "line_end": 672,  "note": "genimg_get_format returns the LEGACY format value, which boot_get_kernel then uses to take the no-signature branch."},
        {"file": "common/cmd_bootm.c", "line_start": 955,  "line_end": 996,  "note": "case IMAGE_FORMAT_LEGACY in boot_get_kernel: calls image_get_kernel (line 958) for legacy verification, populates legacy_hdr_os and os_data/os_len. No fit_image_verify, no rsa_verify, no signature primitive on this branch."},
        {"file": "common/cmd_bootm.c", "line_start": 862,  "line_end": 893,  "note": "image_get_kernel: legacy uImage 'verify' — image_check_magic (866), image_check_hcrc (873), image_check_dcrc (884). All three are CRC32 integrity checks; none is a cryptographic signature."},
        {"file": "include/image.h",    "line_start": 239,  "line_end": 239,  "note": "#define IH_MAGIC 0x27051956 — the magic the attacker crafts"},
        {"file": "include/image.h",    "line_start": 415,  "line_end": 416,  "note": "#define IMAGE_FORMAT_LEGACY 0x01 / IMAGE_FORMAT_FIT 0x02 — the format-tag constants whose dispatch is the bypass"}
      ],
      "confidence": "high",
      "uncertainty": "None on the structural chain. The exact reachability of the bootm load address from an external attacker depends on each deployment's storage and boot-script writability — that variability is documented in conditions.required and conditions.blocking. The CVE itself is structural to U-Boot 2013.07-rc1..2014.07-rc2 and the patch (21d29f7f) closes it generically by making the legacy format path opt-in."
    }
  ]
}
