{
  "schema_version": "v1",
  "project": "sudo",
  "cve": "CVE-2021-3156",
  "evidence_irs": [
    {
      "id": "IR-001",
      "entrypoint": {
        "function": "sudoers_policy_check",
        "file": "plugins/sudoers/policy.c",
        "line": 1013
      },
      "runtime_context": {
        "trigger_type": "callback",
        "trigger_ref": "Any local user (no sudoers entry required) invokes 'sudoedit -s cmd arg\\' where 'arg\\' is an argument ending in a single backslash and at least one further argument follows. sudo_mode = MODE_EDIT|MODE_SHELL.",
        "config_flags": ["sudoedit -s (MODE_EDIT|MODE_SHELL)", "argv has >= 3 elements: [cmd, arg\\, nextarg, ...]"]
      },
      "path": {
        "nodes": [
          {"function": "sudoers_policy_check",   "file": "plugins/sudoers/policy.c",    "line": 1013, "role": "entry"},
          {"function": "sudoers_policy_check",   "file": "plugins/sudoers/policy.c",    "line": 1021, "role": "guard"},
          {"function": "sudoers_policy_check",   "file": "plugins/sudoers/policy.c",    "line": 1028, "role": "intermediate"},
          {"function": "sudoers_policy_main",    "file": "plugins/sudoers/sudoers.c",   "line": 332,  "role": "intermediate"},
          {"function": "sudoers_policy_main",    "file": "plugins/sudoers/sudoers.c",   "line": 401,  "role": "intermediate"},
          {"function": "set_cmnd",               "file": "plugins/sudoers/sudoers.c",   "line": 918,  "role": "intermediate"},
          {"function": "set_cmnd",               "file": "plugins/sudoers/sudoers.c",   "line": 935,  "role": "guard"},
          {"function": "set_cmnd",               "file": "plugins/sudoers/sudoers.c",   "line": 953,  "role": "guard"},
          {"function": "set_cmnd",               "file": "plugins/sudoers/sudoers.c",   "line": 958,  "role": "intermediate"},
          {"function": "set_cmnd",               "file": "plugins/sudoers/sudoers.c",   "line": 960,  "role": "intermediate"},
          {"function": "set_cmnd",               "file": "plugins/sudoers/sudoers.c",   "line": 964,  "role": "guard"},
          {"function": "set_cmnd",               "file": "plugins/sudoers/sudoers.c",   "line": 970,  "role": "intermediate"},
          {"function": "set_cmnd",               "file": "plugins/sudoers/sudoers.c",   "line": 972,  "role": "guard"},
          {"function": "set_cmnd",               "file": "plugins/sudoers/sudoers.c",   "line": 974,  "role": "sink"}
        ],
        "edges": [
          {"from": "sudoers_policy_check@1028", "to": "sudoers_policy_main@332", "kind": "call"},
          {"from": "sudoers_policy_main@401",   "to": "set_cmnd@918",            "kind": "call"},
          {"from": "set_cmnd@935",              "to": "set_cmnd@953",            "kind": "controlflow"},
          {"from": "set_cmnd@960",              "to": "set_cmnd@964",            "kind": "controlflow"},
          {"from": "set_cmnd@964",              "to": "set_cmnd@970",            "kind": "controlflow"},
          {"from": "set_cmnd@972",              "to": "set_cmnd@974",            "kind": "controlflow"}
        ]
      },
      "conditions": {
        "required": [
          "sudo_mode has MODE_SHELL set (attacker uses -s flag) and MODE_EDIT set (invoked as sudoedit or sudo -e).",
          "NewArgc > 1: there are additional arguments beyond the command name (sudoedit receives files to edit).",
          "At least one argument in NewArgv[1..] ends in a single backslash before the null terminator.",
          "The argv strings are stored contiguously in memory (normal for OS-provided argv): the byte following arg\\\\'s null terminator is the first byte of the next argument string (non-null).",
          "The next argument in av (processed in the outer for-loop iteration) further inflates the bytes written to user_args, causing the cumulative write to exceed size."
        ],
        "blocking": [
          "The fix in commit 1f8638577: (1) adds `from[1] != '\\0'` to the backslash-skip condition (line 972 in the fix), preventing from advancing past the null terminator; (2) adds bounds checks before each write to user_args; (3) adds `&&ISSET(sudo_mode, MODE_RUN)` to the unescape condition at line 964, preventing sudoedit from entering the unescape path entirely."
        ]
      },
      "evidence_anchors": [
        {"file": "plugins/sudoers/policy.c",  "line_start": 1013, "line_end": 1013, "note": "sudoers_policy_check declaration — plugin API entry and trust boundary"},
        {"file": "plugins/sudoers/policy.c",  "line_start": 1021, "line_end": 1022, "note": "MODE_EDIT check: sets MODE_RUN if NOT sudoedit. For sudoedit, sudo_mode retains only MODE_EDIT (no MODE_RUN added here)."},
        {"file": "plugins/sudoers/policy.c",  "line_start": 1028, "line_end": 1028, "note": "sudoers_policy_main(argc, argv, ...) call — argv flows through"},
        {"file": "plugins/sudoers/sudoers.c", "line_start": 332,  "line_end": 333,  "note": "sudoers_policy_main declaration"},
        {"file": "plugins/sudoers/sudoers.c", "line_start": 401,  "line_end": 401,  "note": "set_cmnd() call in sudoers_policy_main — before any credential check"},
        {"file": "plugins/sudoers/sudoers.c", "line_start": 918,  "line_end": 918,  "note": "set_cmnd declaration"},
        {"file": "plugins/sudoers/sudoers.c", "line_start": 958,  "line_end": 960,  "note": "user_args allocation: size = sum(strlen(av)+1). This does NOT account for the extra bytes read when an arg ends in backslash."},
        {"file": "plugins/sudoers/sudoers.c", "line_start": 964,  "line_end": 964,  "note": "Unescape condition: ISSET(sudo_mode, MODE_SHELL|MODE_LOGIN_SHELL) — missing &&ISSET(sudo_mode, MODE_RUN). Fires for sudoedit."},
        {"file": "plugins/sudoers/sudoers.c", "line_start": 970,  "line_end": 978,  "note": "Vulnerable unescape loop. Line 972: backslash-skip with no null check. Line 974: *to++ = *from++ — the heap overflow sink when to >= user_args + size."},
        {"file": "src/parse_args.c",           "line_start": 604,  "line_end": 604,  "note": "Argv escaping guard: ISSET(mode, MODE_RUN) && ISSET(flags, MODE_SHELL). For sudoedit (MODE_EDIT), this block is NOT entered — arguments are NOT escaped by the front-end."}
      ],
      "confidence": "high",
      "uncertainty": "The overflow requires contiguous argv string layout in memory. This is the standard OS behavior (Linux kernel stores argv strings contiguously on the stack) but is not guaranteed by the C standard. In practice it is universally true for Linux processes. The number of extra bytes written depends on the length of the argument following the backslash-terminated argument."
    }
  ]
}
